[
  {
    "text": "STAFF WANTED:- EEE department, Qualification minimum B.E. , First class",
    "link": "",
    "position": 0,
    "visible": true
  },
  {
    "text": "Feedback facility of students and faculties available in AICTE web portal",
    "position": 2,
    "visible": true,
    "link": "/events/annual-day"
  }
]